{
  "$schema": "https://json-schema.org/draft/2020-12/schema",
  "$id": "urn:sv08:printer-definitions:0.1:board",
  "type": "object",
  "required": [
    "format_version",
    "id",
    "version",
    "kind",
    "name",
    "category",
    "hardware",
    "compatibility",
    "sources",
    "license"
  ],
  "properties": {
    "format_version": {
      "const": "0.1"
    },
    "id": {
      "type": "string",
      "pattern": "^[a-z][a-z0-9_.-]{0,79}$"
    },
    "version": {
      "type": "string",
      "pattern": "^[0-9]+\\.[0-9]+\\.[0-9]+(?:-[a-z0-9.-]+)?$"
    },
    "kind": {
      "const": "board"
    },
    "name": {
      "type": "string"
    },
    "description": {
      "type": "string"
    },
    "aliases": {
      "type": "array",
      "items": {
        "type": "string"
      },
      "maxItems": 32
    },
    "category": {
      "type": "string"
    },
    "hardware": {
      "type": "object"
    },
    "compatibility": {
      "type": "object"
    },
    "sources": {
      "type": "array",
      "minItems": 1,
      "maxItems": 256,
      "items": {
        "type": "object",
        "required": [
          "id",
          "locator"
        ],
        "properties": {
          "id": {
            "type": "string"
          },
          "url": {
            "type": "string"
          },
          "revision": {
            "type": "string"
          },
          "sha256": {
            "type": "string"
          },
          "locator": {
            "type": "string"
          },
          "evidence": {
            "type": "string"
          }
        },
        "additionalProperties": false
      }
    },
    "license": {
      "type": "string"
    },
    "extensions": {
      "type": "object"
    },
    "dependencies": {
      "type": "array"
    },
    "conflicts": {
      "type": "array"
    },
    "inputs": {
      "type": "object"
    },
    "calibration": {
      "type": "array"
    },
    "unresolved": {},
    "mapping": {
      "type": "object"
    }
  },
  "additionalProperties": false
}
